Id,Número De Víctimas,Fecha,Año,Mes,Día,Hora,Cantidad Hora,Lugar Del Hecho,Tipo De Calle,Calle,Cruce,Dirección Normalizada,Comuna,Coordenadas XY (CABA),Pos X,Pos Y,Participantes,Víctima,Acusado,Rol,Sexo,Edad,Barrios,Código Día,Día Semana,Franja Horaria
2018-0026,2,2018-03-09,2018,3,9,2024-01-16 04:45:00,4,"Rabanal, Francisco, Intendente Av. Y Saenz Av.",Avenida,"Rabanal, Francisco, Intendente Av.",Si,"Rabanal, Francisco, Intendente Av. Y Saenz Av.",4,Point (104283.01090451 97171.08656182),-58.41657793,-34.65476216,Movil-Cargas,Movil,Cargas,Conductor,Masculino,24,"La Boca, Barracas, Parque Patricios y Nueva Pompeya.",4,Viernes,Madrugada
2018-0026,2,2018-03-09,2018,3,9,2024-01-16 04:45:00,4,"Rabanal, Francisco, Intendente Av. Y Saenz Av.",Avenida,"Rabanal, Francisco, Intendente Av.",Si,"Rabanal, Francisco, Intendente Av. Y Saenz Av.",4,Point (104283.01090451 97171.08656182),-58.41657793,-34.65476216,Movil-Cargas,Movil,Cargas,Pasajero_Acompañante,Masculino,30,"La Boca, Barracas, Parque Patricios y Nueva Pompeya.",4,Viernes,Madrugada
2018-0027,1,2018-03-11,2018,3,11,2024-01-16 23:00:00,23,Castro Y Rondeau,Calle,Castro,Si,Castro Y Rondeau,5,Point (104051.46146857 99117.09528964),-58.41911301,-34.63722107,Peaton-Moto,Peaton,Moto,Peaton,Femenino,74,Almagro y Boedo.,6,Domingo,Noche
2018-0028,1,2018-03-13,2018,3,13,2024-01-16 15:45:00,15,"Bilbao, Francisco Av. Y Azul",Avenida,"Bilbao, Francisco Av.",Si,"Bilbao, Francisco Av. Y Azul",9,Point (99275.15851476 98531.15835355),-58.47120586,-34.64251042,Peaton-Cargas,Peaton,Cargas,Peaton,Masculino,71,"Liniers, Mataderos y Parque Avellaneda.",1,Martes,Tarde
2018-0029,1,2018-03-15,2018,3,15,2024-01-16 18:00:00,18,Nazca Av. Y Gaona Av.,Avenida,Nazca Av.,Si,Nazca Av. Y Gaona Av.,11,Point (99001.33520474 100973.19474422),-58.47418944,-34.62049672,Moto-Auto,Moto,Auto,Conductor,Masculino,26,"Villa General Mitre, Villa Devoto, Villa del Parque y Villa Santa Rita.",3,Jueves,Noche
2018-0030,1,2018-03-20,2018,3,20,2024-01-16 01:30:00,1,Plaza Y Alvarez Thomas Av.,Avenida,Plaza,Si,Plaza Y Alvarez Thomas Av.,15,Point (99641.71055660 105570.42188351),-58.46720441,-34.57905579,Moto-Moto,Moto,Moto,Conductor,Masculino,24,"Chacarita, Villa Crespo, La Paternal, Villa Ortúzar, Agronomía y Parque Chas.",1,Martes,Madrugada
2018-0031,1,2018-03-28,2018,3,28,2024-01-16 10:15:00,10,"Gaona Av. Y Artigas, Jose Gervasio, Gral.",Avenida,Gaona Av.,Si,"Gaona Av. Y Artigas, Jose Gervasio, Gral.",11,Point (99468.64184992 101272.71412938),-58.46909362,-34.6177971,Moto-Cargas,Moto,Cargas,Conductor,Masculino,31,"Villa General Mitre, Villa Devoto, Villa del Parque y Villa Santa Rita.",2,Miércoles,Mañana
2018-0032,1,2018-04-02,2018,4,2,2024-01-16 13:00:00,13,Cabildo Av. Y Aguilar,Avenida,Cabildo Av.,Si,Cabildo Av. Y Aguilar,13,Point (101491.71965442 106698.43843791),-58.44704343,-34.5688864,Peaton-Pasajeros,Peaton,Pasajeros,Peaton,Masculino,70,"Núñez, Belgrano y Colegiales.",0,Lunes,Tarde
2018-0033,1,2018-04-07,2018,4,7,2024-01-16 07:30:00,7,Camarones Y Lope De Vega Av.,Avenida,Camarones,Si,Camarones Y Lope De Vega Av.,10,Point (96143.57848535 100026.85558450),-58.50535541,-34.62902048,Moto-Cargas,Moto,Cargas,Conductor,Femenino,42,"Villa Real, Monte Castro, Versalles, Floresta, Vélez Sarsfield y Villa Luro.",5,Sábado,Mañana
2018-0034,1,2018-04-11,2018,4,11,2024-01-16 18:15:00,18,Santa Fe Av. 2320,Avenida,Santa Fe Av.,No,Santa Fe Av. 2320,2,Point (105786.93203839 103775.29320399),-58.40021675,-34.59522198,Peaton-Pasajeros,Peaton,Pasajeros,Peaton,Masculino,24,Recoleta.,2,Miércoles,Noche
2018-0035,1,2018-04-12,2018,4,12,2024-01-16 16:45:00,16,Av. Rivadavia 6950,Avenida,Rivadavia Av.,No,Rivadavia Av. 6950,7,Point (100003.66169818 100008.18099088),-58.46325991,-34.62919627,Peaton-Pasajeros,Peaton,Pasajeros,Peaton,Femenino,39,Flores y Parque Chacabuco.,3,Jueves,Tarde
2018-0036,1,2018-04-13,2018,4,13,2024-01-16 23:15:00,23,Av. San Martín Y Argerich,Avenida,San Martin Av.,Si,San Martin Av. Y Argerich,15,Point (97118.17245497 103585.17867883),-58.49471482,-34.59694755,Moto-Auto,Moto,Auto,Conductor,Masculino,37,"Chacarita, Villa Crespo, La Paternal, Villa Ortúzar, Agronomía y Parque Chas.",4,Viernes,Noche
2018-0037,1,2018-04-18,2018,4,18,2024-01-16 18:45:00,18,"Cordoba Av. Y Uriburu Jose E., Pres.",Avenida,Cordoba Av.,Si,"Cordoba Av. Y Uriburu Jose E., Pres.",2,Point (105923.35790409 103271.83194351),-58.3987261,-34.59975962,Peaton-Cargas,Peaton,Cargas,Peaton,Masculino,84,Recoleta.,2,Miércoles,Noche
2018-0038,2,2018-04-20,2018,4,20,2024-01-16 17:10:00,17,Av. Rivadavia 1571,Avenida,Rivadavia Av.,No,Rivadavia Av. 1571,1,Point (106840.31999667 102262.72809661),-58.38872177,-34.60885045,Peaton-Auto,Peaton,Auto,Peaton,Femenino,59,"Retiro, San Nicolás, Puerto Madero, San Telmo, Montserrat y Constitución.",4,Viernes,Tarde
2018-0038,2,2018-04-20,2018,4,20,2024-01-16 17:10:00,17,Av. Rivadavia 1571,Avenida,Rivadavia Av.,No,Rivadavia Av. 1571,1,Point (106840.31999667 102262.72809661),-58.38872177,-34.60885045,Peaton-Auto,Peaton,Auto,Peaton,Masculino,61,"Retiro, San Nicolás, Puerto Madero, San Telmo, Montserrat y Constitución.",4,Viernes,Tarde
2018-0039,1,2018-04-21,2018,4,21,2024-01-16 22:15:00,22,Autopista Lugones Km 4.7,Autopista,"Lugones, Leopoldo Av.",No,Autopista Lugones Km 4.7,14,Point (0 0),0.0,0.0,Peaton-Auto,Peaton,Auto,Peaton,Masculino,37,Palermo.,5,Sábado,Noche
2018-0040,1,2018-04-27,2018,4,27,2024-01-16 11:00:00,11,Ramon Freire Y Virrey Olaguer Y Feliu,Calle,"Freire, Ramon, Cap. Gral.",Si,"Freire, Ramon, Cap. Gral. Y Olaguer Y Feliu, Virrey",13,Point (100590.76036525 106235.55299971),-58.45686132,-34.57305993,Peaton-Cargas,Peaton,Cargas,Peaton,Femenino,51,"Núñez, Belgrano y Colegiales.",4,Viernes,Mañana
2018-0041,1,2018-04-27,2018,4,27,2024-01-16 13:30:00,13,"La Plata Av. Y Fernandez De La Cruz, F., Gral. Av.",Avenida,La Plata Av.,Si,"La Plata Av. Y Fernandez De La Cruz, F., Gral. Av.",4,Point (103711.66698694 98495.65433114),-58.42281627,-34.64282424,Peaton-Pasajeros,Peaton,Pasajeros,Peaton,Femenino,78,"La Boca, Barracas, Parque Patricios y Nueva Pompeya.",4,Viernes,Tarde
2018-0042,1,2018-04-27,2018,4,27,2024-01-16 18:43:00,18,Brandsen Y Perdriel,Calle,Brandsen,Si,Brandsen Y Perdriel,4,Point (107026.83754260 98858.75172681),-58.38666024,-34.63953396,Moto-Cargas,Moto,Cargas,Pasajero_Acompañante,Masculino,23,"La Boca, Barracas, Parque Patricios y Nueva Pompeya.",4,Viernes,Noche
2018-0043,1,2018-04-28,2018,4,28,2024-01-16 06:30:00,6,"Vilardebo, Teodoro Y Alvarez Jonte Av.",Avenida,"Vilardebo, Teodoro",Si,"Vilardebo, Teodoro Y Alvarez Jonte Av.",11,Point (97438.46582767 101907.03915052),-58.49122843,-34.61207587,Moto-Auto,Moto,Auto,Conductor,Masculino,25,"Villa General Mitre, Villa Devoto, Villa del Parque y Villa Santa Rita.",5,Sábado,Mañana
2018-0044,1,2018-04-28,2018,4,28,2024-01-16 09:00:00,9,Alberti E Independencia Av.,Avenida,Alberti,Si,Alberti E Independencia Av.,3,Point (105715.04318224 101174.58167004),-58.40098306,-34.61866627,Peaton-Auto,Peaton,Auto,Peaton,Femenino,50,Balvanera y San Cristóbal.,5,Sábado,Mañana
2018-0045,1,2018-04-30,2018,4,30,2024-01-16 07:00:00,7,Alvarez Thomas Av. 879,Avenida,Alvarez Thomas Av.,No,Alvarez Thomas Av. 879,13,Point (100808.33159423 105557.81994917),-58.45448963,-34.5791692,Auto-Cargas,Auto,Cargas,Conductor,Masculino,60,"Núñez, Belgrano y Colegiales.",0,Lunes,Mañana
2018-0046,1,2018-05-02,2018,5,2,2024-01-16 03:15:00,3,Av. Gral. Paz Y Av. Rivadavia,Gral Paz,"Paz, Gral. Av.",Si,"Paz, Gral. Av. Y Rivadavia Av.",9,Point (93950.50587297 98883.37644525),-58.52927982,-34.63931752,Peaton-Auto,Peaton,Auto,Peaton,Masculino,11,"Liniers, Mataderos y Parque Avellaneda.",2,Miércoles,Madrugada
2018-0047,1,2018-05-08,2018,5,8,2024-01-16 19:00:00,19,Av. Corrientes Y Av. Dorrego,Avenida,Corrientes Av.,Si,Corrientes Av. Y Dorrego Av.,15,Point (101440.29935254 104167.40204334),-58.44759966,-34.5917024,Peaton-Pasajeros,Peaton,Pasajeros,Peaton,Masculino,82,"Chacarita, Villa Crespo, La Paternal, Villa Ortúzar, Agronomía y Parque Chas.",1,Martes,Noche
2018-0048,1,2018-05-09,2018,5,9,2024-01-16 10:30:00,10,Rivadavia Av. Y Pedernera,Avenida,Rivadavia Av.,Si,Rivadavia Av. Y Pedernera,7,Point (99925.51296558 100002.14427355),-58.46411215,-34.62925068,Peaton-Pasajeros,Peaton,Pasajeros,Peaton,Masculino,57,Flores y Parque Chacabuco.,2,Miércoles,Mañana
2018-0049,1,2018-05-11,2018,5,11,2024-01-16 19:15:00,19,Quesada 2300,Calle,Quesada,No,Quesada 2300,13,Point (100107.11808300 108354.57023193),-58.4621322,-34.55395823,Peaton-Auto,Peaton,Auto,Peaton,Femenino,40,"Núñez, Belgrano y Colegiales.",4,Viernes,Noche
2018-0050,1,2018-05-14,2018,5,14,2024-01-16 18:45:00,18,Cabildo Av. Y Juramento Av.,Avenida,Cabildo Av.,Si,Cabildo Av. Y Juramento Av.,13,Point (100606.16651489 107458.45493347),-58.45669422,-34.5620361,Peaton-Pasajeros,Peaton,Pasajeros,Peaton,Femenino,47,"Núñez, Belgrano y Colegiales.",0,Lunes,Noche
2018-0051,1,2018-05-15,2018,5,15,2024-01-16 21:15:00,21,"California Y Carbonari, Francisco, Cmte.",Calle,California,Si,"California Y Carbonari, Francisco, Cmte.",4,Point (109491.72835084 98425.60443682),-58.3597716,-34.64341878,Peaton-Auto,Peaton,Auto,Peaton,Femenino,57,"La Boca, Barracas, Parque Patricios y Nueva Pompeya.",1,Martes,Noche
2018-0052,1,2018-05-18,2018,5,18,2024-01-16 20:30:00,20,"Carril, Salvador Maria Del Av. Y Nazca",Avenida,"Carril, Salvador Maria Del Av.",Si,"Carril, Salvador Maria Del Av. Y Nazca",15,Point (96798.08806617 104278.02817622),-58.49820145,-34.59070093,Peaton-Pasajeros,Peaton,Pasajeros,Peaton,Masculino,78,"Chacarita, Villa Crespo, La Paternal, Villa Ortúzar, Agronomía y Parque Chas.",4,Viernes,Noche
2018-0053,1,2018-05-20,2018,5,20,2024-01-16 02:30:00,2,San Luis Y Aguero,Calle,San Luis,Si,San Luis Y Aguero,3,Point (104834.84104085 103313.26202067),-58.4105928,-34.5993918,Moto-Auto,Moto,Auto,Conductor,Masculino,43,Balvanera y San Cristóbal.,6,Domingo,Madrugada
2018-0054,1,2018-05-22,2018,5,22,2024-01-16 11:15:00,11,Lugones 2430,Calle,Lugones,No,Lugones 2430,12,Point (98495.84519532 106440.03052817),-58.47969138,-34.57121563,Peaton-Bicicleta,Peaton,Bicicleta,Peaton,Femenino,86,"Coghlan, Saavedra, Villa Urquiza y Villa Pueyrredón.",1,Martes,Mañana
2018-0055,1,2018-05-29,2018,5,29,2024-01-16 07:30:00,7,Independencia Av. Y Jujuy Av.,Avenida,Independencia Av.,Si,Independencia Av. Y Jujuy Av.,3,Point (105482.77183741 101155.54165898),-58.40351561,-34.61883916,Moto-Auto,Moto,Auto,Conductor,Masculino,21,Balvanera y San Cristóbal.,1,Martes,Mañana
2018-0056,1,2018-06-02,2018,6,2,2024-01-16 13:00:00,13,Av. Rivadavia 11050,Avenida,Rivadavia Av.,No,Rivadavia Av. 11050,9,Point (94825.31796080 98898.07278223),-58.51973844,-34.63918987,Peaton-Pasajeros,Peaton,Pasajeros,Peaton,Femenino,69,"Liniers, Mataderos y Parque Avellaneda.",5,Sábado,Tarde
2018-0057,1,2018-06-03,2018,6,3,2024-01-16 03:30:00,3,Combate De Los Pozos Y Humberto 1°,Calle,Combate De Los Pozos,Si,Combate De Los Pozos Y Humberto 1Â°,3,Point (106436.50690531 100845.32785530),-58.39311376,-34.62163006,Moto-Pasajeros,Moto,Pasajeros,Conductor,Masculino,33,Balvanera y San Cristóbal.,6,Domingo,Madrugada
2018-0058,1,2018-06-03,2018,6,3,2024-01-16 06:30:00,6,Cordoba Av. Y Thames,Avenida,Cordoba Av.,Si,Cordoba Av. Y Thames,15,Point (102567.54814228 104264.87527568),-58.43531242,-34.59082159,Moto-Auto,Moto,Auto,Conductor,Masculino,26,"Chacarita, Villa Crespo, La Paternal, Villa Ortúzar, Agronomía y Parque Chas.",6,Domingo,Mañana
2018-0059,1,2018-06-08,2018,6,8,2024-01-16 06:20:00,6,"Garay, Juan De Av. Y Sanchez De Loria",Avenida,"Garay, Juan De Av.",Si,"Garay, Juan De Av. Y Sanchez De Loria",5,Point (104724.05358972 99878.51159963),-58.41178165,-34.63035454,Moto-Movil,Moto,Otro,Conductor,Masculino,54,Almagro y Boedo.,4,Viernes,Mañana
2018-0060,1,2018-06-08,2018,6,8,2024-01-16 12:50:00,12,"Lavalle Y Alem, Leandro N. Av.",Avenida,Lavalle,Si,"Lavalle Y Alem, Leandro N. Av.",1,Point (108513.43549456 103032.95078343),-58.370488,-34.60189492,Peaton-Pasajeros,Peaton,Pasajeros,Peaton,Masculino,51,"Retiro, San Nicolás, Puerto Madero, San Telmo, Montserrat y Constitución.",4,Viernes,Tarde
2018-0061,1,2018-06-10,2018,6,10,2024-01-16 11:15:00,11,Estados Unidos Y Pichincha,Calle,Estados Unidos,Si,Estados Unidos Y Pichincha,3,Point (105911.62147898 101065.51501699),-58.39883882,-34.61964833,Moto-Moto,Moto,Moto,Conductor,Masculino,51,Balvanera y San Cristóbal.,6,Domingo,Mañana
2018-0062,1,2018-06-14,2018,6,14,2024-01-16 01:00:00,1,Rosario Y Barco Centenera Del,Calle,Rosario,Si,Rosario Y Barco Centenera Del,6,Point (102035.73876399 100936.73706899),-58.44110156,-34.62082399,Peaton-Cargas,Peaton,Cargas,Peaton,Masculino,32,Caballito.,3,Jueves,Madrugada
2018-0063,1,2018-06-16,2018,6,16,2024-01-16 21:15:00,21,Av. Leandro N. Alem Y Viamonte,Avenida,"Alem, Leandro N. Av.",Si,"Alem, Leandro N. Av. Y Viamonte",1,Point (108473.00357935 103295.64162815),-58.37093138,-34.59952725,Peaton-Pasajeros,Peaton,Pasajeros,Peaton,Femenino,28,"Retiro, San Nicolás, Puerto Madero, San Telmo, Montserrat y Constitución.",5,Sábado,Noche
2018-0064,1,2018-06-25,2018,6,25,2024-01-16 01:15:00,1,Varela Av. Y Primera Junta,Avenida,Varela Av.,Si,Varela Av. Y Primera Junta,7,Point (100435.26388900 98861.53271694),-58.45855262,-34.63953253,Auto-Cargas,Auto,Cargas,Conductor,Masculino,30,Flores y Parque Chacabuco.,0,Lunes,Madrugada
2018-0065,1,2018-06-26,2018,6,26,2024-01-16 17:30:00,17,"Pellegrini, Carlos Y Juncal",Calle,"Pellegrini, Carlos",Si,"Pellegrini, Carlos Y Juncal",1,Point (107493.20906271 104038.93317074),-58.38161909,-34.59283447,Moto-Cargas,Moto,Cargas,Conductor,Masculino,35,"Retiro, San Nicolás, Puerto Madero, San Telmo, Montserrat y Constitución.",1,Martes,Tarde
2018-0066,1,2018-06-28,2018,6,28,2024-01-16 11:00:00,11,Av. Corrientes Y Av. Federico Lacroze,Avenida,Corrientes Av.,Si,"Corrientes Av. Y Lacroze, Federico Av.",15,Point (100750.52062158 104691.17506829),-58.45511899,-34.58698157,Peaton-Pasajeros,Peaton,Pasajeros,Peaton,Masculino,73,"Chacarita, Villa Crespo, La Paternal, Villa Ortúzar, Agronomía y Parque Chas.",3,Jueves,Mañana
2018-0067,1,2018-06-29,2018,6,29,2024-01-16 16:15:00,16,"Montes De Oca, Manuel Y Finochietto Enrique Dr.",Avenida,"Montes De Oca, Manuel Av.",Si,"Montes De Oca, Manuel Av. Y Finochietto Enrique Dr.",4,Point (107891.26340037 99945.61487141),-58.37724226,-34.62973033,Pasajeros-Auto,Pasajeros,Auto,Pasajero_Acompañante,Femenino,81,"La Boca, Barracas, Parque Patricios y Nueva Pompeya.",4,Viernes,Tarde
2018-0068,1,2018-07-01,2018,7,1,2024-01-16 09:00:00,9,"Carabobo Av. Y Alberdi, Juan Bautista Av.",Avenida,Carabobo Av.,Si,"Carabobo Av. Y Alberdi, Juan Bautista Av.",7,Point (100718.69831349 99996.27412808),-58.45546217,-34.62930339,Moto-Auto,Moto,Auto,Conductor,Masculino,21,Flores y Parque Chacabuco.,6,Domingo,Mañana
2018-0069,1,2018-07-04,2018,7,4,2024-01-16 21:45:00,21,Córdoba Av. 2215,Avenida,Cordoba Av.,No,Cordoba Av. 2215,2,Point (105900.94104333 103295.18325601),-58.39897064,-34.59954925,Bicicleta-Pasajeros,Bicicleta,Pasajeros,Ciclista,Masculino,20,Recoleta.,2,Miércoles,Noche
2018-0070,1,2018-07-07,2018,7,7,2024-01-16 15:45:00,15,"Estados Unidos Y Urquiza, Gral.",Calle,Estados Unidos,Si,"Estados Unidos Y Urquiza, Gral.",3,Point (104963.31095539 100886.97438212),-58.40917826,-34.62126274,Moto-Pasajeros,Moto,Pasajeros,Conductor,Masculino,33,Balvanera y San Cristóbal.,5,Sábado,Tarde
2018-0071,1,2018-07-10,2018,7,10,2024-01-16 17:50:00,17,Moreno Y Av. Huergo,Avenida,Moreno,Si,"Moreno Y Huergo, Ing. Av.",1,Point (108808.25931028 102022.90885862),-58.36726348,-34.61099738,Moto-Cargas,Moto,Cargas,Conductor,Masculino,40,"Retiro, San Nicolás, Puerto Madero, San Telmo, Montserrat y Constitución.",1,Martes,Tarde
2018-0072,1,2018-07-11,2018,7,11,2024-01-16 13:15:00,13,"Au Dellepiane Kilometro 0.0, Altura Calle Montiel, Sentido Hacia El Centro Porteño",Autopista,Autopista Dellepiane Luis Tte. Gral.,No,Autopista Dellepiane Luis Tte. Gral. Y Montiel,8,Point (98224.62123059 93867.97738800),-58.48267426,-34.68454456,Moto-Cargas,Moto,Cargas,Conductor,Masculino,27,"Villa Soldati, Villa Riachuelo y Villa Lugano.",2,Miércoles,Tarde
2018-0073,1,2018-07-11,2018,7,11,2024-01-16 15:45:00,15,"Iriarte, Gral. Av. 3400",Avenida,"Iriarte, Gral. Av.",No,"Iriarte, Gral. Av. 3400",4,Point (106218.96559101 97510.98250186),-58.39546165,-34.65168841,Peaton-Cargas,Peaton,Cargas,Peaton,Femenino,67,"La Boca, Barracas, Parque Patricios y Nueva Pompeya.",2,Miércoles,Tarde
2018-0074,1,2018-07-14,2018,7,14,2024-01-16 06:04:00,6,Av. Juan B. Alberdi 2968,Avenida,"Alberdi, Juan Bautista Av.",No,"Alberdi, Juan Bautista Av. 2968",7,Point (99438.84176266 99501.28380301),-58.46941984,-34.63376545,Auto-Cargas,Auto,Cargas,Conductor,Masculino,25,Flores y Parque Chacabuco.,5,Sábado,Mañana
2018-0075,1,2018-07-15,2018,7,15,2024-01-16 07:30:00,7,Del Libertador Av. Y Ortiz De Ocampo,Avenida,Del Libertador Av.,Si,Del Libertador Av. Y Ortiz De Ocampo,14,Point (105470.75546311 105320.72785650),-58.40367321,-34.58129246,Peaton-Auto,Peaton,Auto,Peaton,Masculino,23,Palermo.,6,Domingo,Mañana
2018-0076,1,2018-07-16,2018,7,16,2024-01-16 09:30:00,9,"Chavez, Jorge Y Paz, Gral. Av.",Calle,"Chavez, Jorge",Si,"Chavez, Jorge Y Paz, Gral. Av.",9,Point (93946.81673714 97681.68907836),-58.52932872,-34.65014993,Auto-Cargas,Auto,Cargas,Conductor,Masculino,73,"Liniers, Mataderos y Parque Avellaneda.",0,Lunes,Mañana
2018-0077,1,2018-07-16,2018,7,16,2024-01-16 23:15:00,23,"Urquiza, Gral. Y Estados Unidos",Calle,"Urquiza, Gral.",Si,"Urquiza, Gral. Y Estados Unidos",3,Point (104963.31095539 100886.97438212),-58.40917826,-34.62126274,Auto-Cargas,Auto,Cargas,Conductor,Masculino,58,Balvanera y San Cristóbal.,0,Lunes,Noche
2018-0078,1,2018-07-21,2018,7,21,2024-01-16 06:15:00,6,Paraguay Y Sánchez De Bustamante,Calle,Paraguay,Si,Paraguay Y Sanchez De Bustamante,2,Point (104647.18963470 103830.17880585),-58.41264127,-34.59473294,Peaton-Auto,Peaton,Auto,Peaton,Masculino,27,Recoleta.,5,Sábado,Mañana
2018-0079,1,2018-07-23,2018,7,23,2024-01-16 07:15:00,7,"De Los Corrales Av. Y Paz, Gral. Av.",Gral Paz,De Los Corrales Av.,Si,"De Los Corrales Av. Y Paz, Gral. Av.",9,Point (95832.05571093 95505.41641999),-58.50877521,-34.66977709,Peaton-Cargas,Peaton,Cargas,Peaton,Masculino,40,"Liniers, Mataderos y Parque Avellaneda.",0,Lunes,Mañana
2018-0080,1,2018-07-25,2018,7,25,2024-01-16 22:22:00,22,"Alberdi, Juan Bautista Av. Y Carhue",Avenida,"Alberdi, Juan Bautista Av.",Si,"Alberdi, Juan Bautista Av. Y Carhue",9,Point (95506.35959227 96696.89655626),-58.51232237,-34.6590353,Peaton-Auto,Peaton,Auto,Peaton,Masculino,26,"Liniers, Mataderos y Parque Avellaneda.",2,Miércoles,Noche
2018-0081,1,2018-07-29,2018,7,29,2024-01-16 06:30:00,6,Castañares Av. Y Rivera Indarte Av.,Avenida,Castanares Av.,Si,Castaã‘Ares Av. Y Rivera Indarte Av.,7,Point (101453.89687005 98180.39027169),-58.44744156,-34.64567171,Multiple,Peaton,Multiple,Peaton,Masculino,35,Flores y Parque Chacabuco.,6,Domingo,Mañana
2018-0082,1,2018-08-01,2018,8,1,2024-01-16 15:53:00,15,"Larrazabal Y Garzon, Eugenio, Gral. Av.",Avenida,Larrazabal,Si,"Larrazabal Y Garzon, Eugenio, Gral. Av.",9,Point (97148.03881747 96734.79106149),-58.49441273,-34.65869968,Moto-Cargas,Moto,Cargas,Conductor,Femenino,17,"Liniers, Mataderos y Parque Avellaneda.",2,Miércoles,Tarde
2018-0083,1,2018-08-02,2018,8,2,2024-01-16 05:20:00,5,"Paz, Gral. Av. Y Fernandez De La Cruz, F., Gral. Av.",Gral Paz,"Paz, Gral. Av.",Si,"Paz, Gral. Av. Y Fernandez De La Cruz, F., Gral. Av.",8,Point (98491.08733048 93092.87943671),-58.47976785,-34.69153196,Moto-Cargas,Moto,Cargas,Conductor,Masculino,40,"Villa Soldati, Villa Riachuelo y Villa Lugano.",3,Jueves,Madrugada
2018-0084,1,2018-08-03,2018,8,3,2024-01-16 07:25:00,7,Av. Alicia Moreau De Justo Y Cochabamba,Avenida,"Moreau De Justo, Alicia Av.",Si,"Moreau De Justo, Alicia Av. Y Cochabamba",1,Point (108993.20201253 100735.24332429),-58.36523349,-34.62260331,Peaton-Cargas,Peaton,Cargas,Peaton,Masculino,45,"Retiro, San Nicolás, Puerto Madero, San Telmo, Montserrat y Constitución.",4,Viernes,Mañana
2018-0085,2,2018-08-03,2018,8,3,2024-01-16 18:16:00,18,"Entre Rios Av. Y Garay, Juan De Av.",Avenida,Entre Rios Av.,Si,"Entre Rios Av. Y Garay, Juan De Av.",3,Point (106612.54991859 100244.75667446),-58.39118948,-34.62704273,Moto-Pasajeros,Moto,Pasajeros,Pasajero_Acompañante,Femenino,22,Balvanera y San Cristóbal.,4,Viernes,Noche
2018-0085,2,2018-08-03,2018,8,3,2024-01-16 18:16:00,18,"Entre Rios Av. Y Garay, Juan De Av.",Avenida,Entre Rios Av.,Si,"Entre Rios Av. Y Garay, Juan De Av.",3,Point (106612.54991859 100244.75667446),-58.39118948,-34.62704273,Moto-Pasajeros,Moto,Pasajeros,Conductor,Masculino,30,Balvanera y San Cristóbal.,4,Viernes,Noche
2018-0086,1,2018-08-10,2018,8,10,2024-01-16 21:44:00,21,Directorio Av. Y Guardia Nacional,Avenida,Directorio Av.,Si,Directorio Av. Y Guardia Nacional,9,Point (97534.35415051 97682.40955825),-58.49019551,-34.65015854,Peaton-Pasajeros,Peaton,Pasajeros,Peaton,Masculino,40,"Liniers, Mataderos y Parque Avellaneda.",4,Viernes,Noche
2018-0087,1,2018-08-15,2018,8,15,2024-01-16 19:20:00,19,Pavon Av. Y Colombres,Avenida,Pavon Av.,Si,Pavon Av. Y Colombres,5,Point (104296.57153484 99891.67281595),-58.41644362,-34.63023775,Peaton-Pasajeros,Peaton,Pasajeros,Peaton,Masculino,75,Almagro y Boedo.,2,Miércoles,Noche
2018-0088,1,2018-08-17,2018,8,17,2024-01-16 16:36:00,16,Av. Gral. Paz Y Av. Dr. Ricardo Balbín,Gral Paz,"Paz, Gral. Av.",Si,"Paz, Gral. Av. Y Balbin, Ricardo, Dr. Av.",12,Point (96563.66494817 108815.73881056),-58.5007381,-34.5497951,Moto-Cargas,Moto,Cargas,Conductor,Masculino,40,"Coghlan, Saavedra, Villa Urquiza y Villa Pueyrredón.",4,Viernes,Tarde
2018-0089,1,2018-08-17,2018,8,17,2024-01-16 17:56:00,17,Pichincha Av. Y Brasil,Avenida,Pichincha Av.,Si,Pichincha Av. Y Brasil,4,Point (106147.25140863 99876.44981079),-58.39626094,-34.63036565,Peaton-Pasajeros,Peaton,Pasajeros,Peaton,Masculino,80,"La Boca, Barracas, Parque Patricios y Nueva Pompeya.",4,Viernes,Tarde
2018-0090,1,2018-08-18,2018,8,18,2024-01-16 10:34:00,10,27 De Febrero Av. Y Pergamino,Avenida,27 De Febrero Av.,Si,27 De Febrero Av. Y Pergamino,8,Point (102791.00899168 95424.06973029),-58.43284809,-34.67051543,Moto-Auto,Moto,Auto,Conductor,Masculino,27,"Villa Soldati, Villa Riachuelo y Villa Lugano.",5,Sábado,Mañana
2018-0091,1,2018-08-19,2018,8,19,2024-01-16 18:47:00,18,Au Perito Moreno Km 1.8 Altura Barragan Sentido Pba,Autopista,Autopista Perito Moreno,Si,Autopista Perito Moreno Y Barragan,9,Point (94544.31344300 99185.28796442),-58.52280139,-34.63659934,Auto-Auto,Auto,Auto,Pasajero_Acompañante,Femenino,23,"Liniers, Mataderos y Parque Avellaneda.",6,Domingo,Noche
2018-0092,1,2018-08-20,2018,8,20,2024-01-16 08:20:00,8,Cordoba Av. Y Gascon,Avenida,Cordoba Av.,Si,Cordoba Av. Y Gascon,14,Point (103662.91363929 103496.49206019),-58.4233693,-34.59774487,Moto-Auto,Moto,Auto,Conductor,Masculino,23,Palermo.,0,Lunes,Mañana
2018-0093,1,2018-08-20,2018,8,20,2024-01-16 08:41:00,8,15 De Noviembre De 1889 1513,Calle,15 De Noviembre De 1889,No,15 De Noviembre De 1889 1513,1,Point (107004.02001368 99798.84856249),-58.38691681,-34.63105973,Peaton-Pasajeros,Peaton,Pasajeros,Peaton,Masculino,24,"Retiro, San Nicolás, Puerto Madero, San Telmo, Montserrat y Constitución.",0,Lunes,Mañana
2018-0094,1,2018-08-23,2018,8,23,2024-01-16 05:35:00,5,"Salguero, Jeronimo Y Beruti",Calle,"Salguero, Jeronimo",Si,"Salguero, Jeronimo Y Beruti",14,Point (104734.93787233 104821.22705013),-58.4116902,-34.5857988,Moto-Pasajeros,Moto,Pasajeros,Conductor,Masculino,32,Palermo.,3,Jueves,Madrugada
2018-0095,1,2018-08-26,2018,8,26,2024-01-16 00:59:00,0,"Lacarra Av. Y Dellepiane, Luis, Tte. Gral.",Avenida,Lacarra Av.,Si,"Lacarra Av. Y Dellepiane, Luis, Tte. Gral.",9,Point (99624.29795829 97569.69801131),-58.46739825,-34.65117757,Auto-Auto,Auto,Auto,Pasajero_Acompañante,Femenino,49,"Liniers, Mataderos y Parque Avellaneda.",6,Domingo,Madrugada
2018-0096,1,2018-08-31,2018,8,31,2024-01-16 22:20:00,22,"Au Héctor J. Cámpora Y Roca, Cnel. Av.",Autopista,Autopista Presidente H?Ctor J. C?Mpora,Si,"Autopista Presidente Hã‰Ctor J. CãMpora Y Roca, Cnel. Av.",8,Point (101692.57924565 95312.63822646),-58.44483258,-34.67152226,Peaton-Auto,Peaton,Auto,Peaton,Masculino,39,"Villa Soldati, Villa Riachuelo y Villa Lugano.",4,Viernes,Noche
2018-0097,1,2018-09-02,2018,9,2,2024-01-16 10:50:00,10,Av. Varela Y Av. Int. Francisco Rabanal,Avenida,Varela Av.,Si,"Varela Av. Y Rabanal, Francisco, Intendente Av.",8,Point (102819.52927414 96448.46140692),-58.43254025,-34.66128115,Auto-Movil,Auto,Otro,Conductor,Femenino,35,"Villa Soldati, Villa Riachuelo y Villa Lugano.",6,Domingo,Mañana
2018-0098,2,2018-09-09,2018,9,9,2024-01-16 05:00:00,5,Av. Gral. Paz E/ Ferre Y Beron De Astrada,Gral Paz,"Paz, Gral. Av.",Si,"Paz, Gral. Av. Y Beron De Astrada",8,Point (99203.46279192 92552.75548716),-58.47199387,-34.69640164,Auto-Auto,Auto,Auto,Conductor,Masculino,55,"Villa Soldati, Villa Riachuelo y Villa Lugano.",6,Domingo,Madrugada
2018-0098,2,2018-09-09,2018,9,9,2024-01-16 05:00:00,5,Av. Gral. Paz E/ Ferre Y Beron De Astrada,Gral Paz,"Paz, Gral. Av.",Si,"Paz, Gral. Av. Y Beron De Astrada",8,Point (99203.46279192 92552.75548716),-58.47199387,-34.69640164,Auto-Auto,Auto,Auto,Pasajero_Acompañante,Masculino,54,"Villa Soldati, Villa Riachuelo y Villa Lugano.",6,Domingo,Madrugada
2018-0099,1,2018-09-12,2018,9,12,2024-01-16 14:25:00,14,Rivadavia Av. Y Pedernera,Avenida,Rivadavia Av.,Si,Rivadavia Av. Y Pedernera,7,Point (99925.51296558 100002.14427355),-58.46411215,-34.62925068,Peaton-Pasajeros,Peaton,Pasajeros,Peaton,Masculino,18,Flores y Parque Chacabuco.,2,Miércoles,Tarde
