Id,Número De Víctimas,Fecha,Año,Mes,Día,Hora,Cantidad Hora,Lugar Del Hecho,Tipo De Calle,Calle,Cruce,Dirección Normalizada,Comuna,Coordenadas XY (CABA),Pos X,Pos Y,Participantes,Víctima,Acusado,Rol,Sexo,Edad,Barrios,Código Día,Día Semana,Franja Horaria
2016-0001,1,2016-01-01,2016,1,1,2024-01-16 04:00:00,4,Av Piedra Buena Y Av Fernandez De La Cruz,Avenida,Piedra Buena Av.,Si,"Piedra Buena Av. Y Fernandez De La Cruz, F., Gral. Av.",8,Point (98896.78238426 93532.43437792),-58.47533969,-34.68757022,Moto-Auto,Moto,Auto,Conductor,Masculino,19,"Villa Soldati, Villa Riachuelo y Villa Lugano.",4,Viernes,Madrugada
2016-0002,1,2016-01-02,2016,1,2,2024-01-16 01:15:00,1,Av Gral Paz  Y Av De Los Corrales,Gral Paz,"Paz, Gral. Av.",Si,"Paz, Gral. Av. Y De Los Corrales Av.",9,Point (95832.05571093 95505.41641999),-58.50877521,-34.66977709,Auto-Pasajeros,Auto,Pasajeros,Conductor,Masculino,70,"Liniers, Mataderos y Parque Avellaneda.",5,Sábado,Madrugada
2016-0003,1,2016-01-03,2016,1,3,2024-01-16 07:00:00,7,Av Entre Rios 2034,Avenida,Entre Rios Av.,No,Entre Rios Av. 2034,1,Point (106684.29090040 99706.57687843),-58.39040293,-34.63189362,Moto-Auto,Moto,Auto,Conductor,Masculino,30,"Retiro, San Nicolás, Puerto Madero, San Telmo, Montserrat y Constitución.",6,Domingo,Mañana
2016-0004,1,2016-01-10,2016,1,10,2024-01-16 00:00:00,0,Av Larrazabal Y Gral Villegas Conrado,Avenida,Larrazabal Av.,Si,"Larrazabal Av. Y Villegas, Conrado, Gral.",8,Point (99840.65224780 94269.16534422),-58.46503904,-34.68092974,Moto-Sd,Moto,Sd,Conductor,Masculino,18,"Villa Soldati, Villa Riachuelo y Villa Lugano.",6,Domingo,Madrugada
2016-0005,1,2016-01-21,2016,1,21,2024-01-16 05:20:00,5,Av San Juan Y Presidente Luis Saenz Peña,Avenida,San Juan Av.,Si,"San Juan Av. Y Saenz Peã‘A, Luis, Pres.",1,Point (106980.32827929 100752.16915795),-58.38718297,-34.6224663,Moto-Pasajeros,Moto,Pasajeros,Conductor,Masculino,29,"Retiro, San Nicolás, Puerto Madero, San Telmo, Montserrat y Constitución.",3,Jueves,Madrugada
2016-0008,1,2016-01-24,2016,1,24,2024-01-16 18:30:00,18,Av 27 De Febrero Y Av Escalada,Avenida,27 De Febrero Av.,Si,27 De Febrero Av. Y Escalada Av.,8,Point (101721.59002217 93844.25656649),-58.44451316,-34.68475866,Moto-Objeto Fijo,Moto,Objeto Fijo,Conductor,Masculino,30,"Villa Soldati, Villa Riachuelo y Villa Lugano.",6,Domingo,Noche
2016-0009,1,2016-01-24,2016,1,24,2024-01-16 19:10:00,19,Nogoya Y Joaquin V. Gonzales,Calle,Nogoya,Si,"Nogoya Y Gonzalez, Joaquin V.",11,Point (96545.87592078 102330.67262199),-58.50095869,-34.6082544,Moto-Auto,Moto,Auto,Pasajero_Acompañante,Masculino,29,"Villa General Mitre, Villa Devoto, Villa del Parque y Villa Santa Rita.",6,Domingo,Noche
2016-0010,1,2016-01-29,2016,1,29,2024-01-16 15:20:00,15,Av General Paz Y Av De Los Corrales,Gral Paz,"Paz, Gral. Av.",Si,"Paz, Gral. Av. Y De Los Corrales Av.",9,Point (95832.05571093 95505.41641999),-58.50877521,-34.66977709,Moto-Auto,Moto,Auto,Conductor,Masculino,18,"Liniers, Mataderos y Parque Avellaneda.",4,Viernes,Tarde
2016-0012,1,2016-02-08,2016,2,8,2024-01-16 01:20:00,1,Av Belgrano Y Bernardo De Irigoyen,Avenida,Belgrano Av.,Si,"Belgrano Av. E Irigoyen, Bernardo De",1,Point (107595.35084333 101797.50052813),-58.38048577,-34.61303893,Moto-Cargas,Moto,Cargas,Conductor,Masculino,22,"Retiro, San Nicolás, Puerto Madero, San Telmo, Montserrat y Constitución.",0,Lunes,Madrugada
2016-0013,1,2016-02-10,2016,2,10,2024-01-16 11:30:00,11,Av Entre Rios 1366,Avenida,Entre Rios Av.,No,Entre Rios Av. 1366,1,Point (106616.41069662 100496.44662323),-58.39114932,-34.62477387,Peaton-Auto,Peaton,Auto,Peaton,Masculino,16,"Retiro, San Nicolás, Puerto Madero, San Telmo, Montserrat y Constitución.",2,Miércoles,Mañana
2016-0015,1,2016-02-14,2016,2,14,2024-01-16 05:14:00,5,Av Scalabrini Ortiz Y Vera,Avenida,"Scalabrini Ortiz, Raul Av.",Si,"Scalabrini Ortiz, Raul Av. Y Vera",15,Point (102357.43746828 103343.52002839),-58.4376002,-34.59912758,Peaton-Auto,Peaton,Auto,Peaton,Femenino,16,"Chacarita, Villa Crespo, La Paternal, Villa Ortúzar, Agronomía y Parque Chas.",6,Domingo,Madrugada
2016-0016,1,2016-02-14,2016,2,14,2024-01-16 22:00:00,22,Av Regimiento De Patricios Y Quinquela Martin Benito,Avenida,Regimiento De Patricios Av.,Si,"Regimiento De Patricios Av. Y Quinquela Martin, Benito",4,Point (108661.59115206 98481.75445555),-58.36882665,-34.64291993,Moto-Auto,Moto,Auto,Pasajero_Acompañante,Femenino,19,"La Boca, Barracas, Parque Patricios y Nueva Pompeya.",6,Domingo,Noche
2016-0017,1,2016-02-15,2016,2,15,2024-01-16 16:54:00,16,Mariano Acosta Y Ana Maria Janer,Avenida,"Acosta, Mariano",Si,"Acosta, Mariano Y Janer, Ana Maria",8,Point (101228.61094416 96623.72136186),-58.44989671,-34.65970435,Peaton-Moto,Peaton,Moto,Peaton,Masculino,59,"Villa Soldati, Villa Riachuelo y Villa Lugano.",0,Lunes,Tarde
2016-0019,1,2016-02-17,2016,2,17,2024-01-16 09:30:00,9,Lisandro De La Torre Y Severo Garcia Grande De Zequeira,Calle,"De La Torre, Lisandro",Si,"De La Torre, Lisandro Y Garcia Grande De Zequeira, Severo",9,Point (95727.37083199 97179.35560349),-58.50990884,-34.65468721,Peaton-Pasajeros,Peaton,Pasajeros,Peaton,Femenino,65,"Liniers, Mataderos y Parque Avellaneda.",2,Miércoles,Mañana
2016-0020,1,2016-02-17,2016,2,17,2024-01-16 16:00:00,16,Suipacha 156,Calle,Suipacha,No,Suipacha 156,1,Point (107684.31807562 102519.17333314),-58.37952223,-34.60653282,Peaton-Auto,Peaton,Auto,Peaton,Masculino,59,"Retiro, San Nicolás, Puerto Madero, San Telmo, Montserrat y Constitución.",2,Miércoles,Tarde
2016-0021,1,2016-02-17,2016,2,17,2024-01-16 23:35:00,23,Av Directorio Y Curapaligue,Avenida,Directorio Av.,Si,Directorio Av. Y Curapaligue,7,Point (101074.94198885 99848.19369046),-58.45157703,-34.63063795,Auto-Auto,Auto,Auto,Conductor,Masculino,34,Flores y Parque Chacabuco.,2,Miércoles,Noche
2016-0022,1,2016-02-21,2016,2,21,2024-01-16 06:00:00,6,Av 9 De Julio Y Adolfo Alsina,Avenida,9 De Julio Av.,Si,"9 De Julio Av. Y Alsina, Adolfo",1,Point (107507.39502374 102046.08333077),-58.38144696,-34.61079875,Moto-Auto,Moto,Auto,Pasajero_Acompañante,Masculino,41,"Retiro, San Nicolás, Puerto Madero, San Telmo, Montserrat y Constitución.",6,Domingo,Mañana
2016-0025,1,2016-02-28,2016,2,28,2024-01-16 04:50:00,4,Av Gral Paz Y Av 27 De Febrero,Gral Paz,"Paz, Gral. Av.",Si,"Paz, Gral. Av. Y 27 De Febrero Av.",8,Point (100077.95205948 91571.23307293),-58.46244952,-34.70524971,Auto-Auto,Auto,Auto,Pasajero_Acompañante,Masculino,34,"Villa Soldati, Villa Riachuelo y Villa Lugano.",6,Domingo,Madrugada
2016-0026,1,2016-02-28,2016,2,28,2024-01-16 07:30:00,7,Holmberg Y Vedia,Calle,Holmberg,Si,Holmberg Y Vedia,12,Point (97350.75566590 109083.19420265),-58.49216191,-34.54738649,Otro-Auto,Auto,Objeto Fijo,Conductor,Masculino,30,"Coghlan, Saavedra, Villa Urquiza y Villa Pueyrredón.",6,Domingo,Mañana
2016-0027,1,2016-02-28,2016,2,28,2024-01-16 09:35:00,9,Curapaligue Y Avelino Diaz,Avenida,Curapaligue Av.,Si,"Curapaligue Av. Y Diaz, Avelino",7,Point (101679.82794245 98973.02976850),-58.44497874,-34.63852623,Auto-Auto,Auto,Auto,Pasajero_Acompañante,Masculino,34,Flores y Parque Chacabuco.,6,Domingo,Mañana
2016-0028,1,2016-03-02,2016,3,2,2024-01-16 10:00:00,10,Viamonte Y Av 9 De Julio,Avenida,Viamonte,Si,Viamonte Y 9 De Julio Av.,1,Point (107457.87314266 103212.28518029),-58.38199706,-34.60028648,Peaton-Cargas,Peaton,Cargas,Peaton,Masculino,50,"Retiro, San Nicolás, Puerto Madero, San Telmo, Montserrat y Constitución.",2,Miércoles,Mañana
2016-0029,1,2016-03-04,2016,3,4,2024-01-16 17:30:00,17,Av Cabildo Y Deheza,Avenida,Cabildo Av.,Si,Cabildo Av. Y Deheza,12,Point (99037.31284333 109733.12041651),-58.47378664,-34.54153077,Peaton-Pasajeros,Peaton,Pasajeros,Peaton,Masculino,38,"Coghlan, Saavedra, Villa Urquiza y Villa Pueyrredón.",4,Viernes,Tarde
2016-0031,1,2016-03-08,2016,3,8,2024-01-16 12:30:00,12,Av Gral Paz Y Av Cnel Roca,Gral Paz,"Paz, Gral. Av.",Si,"Paz, Gral. Av. Y Roca, Cnel. Av.",8,Point (99327.01838497 92326.91130631),-58.47064556,-34.69843756,Moto-Pasajeros,Moto,Pasajeros,Conductor,Masculino,21,"Villa Soldati, Villa Riachuelo y Villa Lugano.",1,Martes,Tarde
2016-0034,1,2016-03-12,2016,3,12,2024-01-16 12:30:00,12,Av Amancio Alcorta Y Bonavena,Avenida,"Alcorta, Amancio Av.",Si,"Alcorta, Amancio Av. Y Bonavena, Oscar Natalio",4,Point (105230.98315750 97613.97258373),-58.40623949,-34.65076549,Peaton-Pasajeros,Peaton,Pasajeros,Peaton,Masculino,52,"La Boca, Barracas, Parque Patricios y Nueva Pompeya.",5,Sábado,Tarde
2016-0035,1,2016-03-13,2016,3,13,2024-01-16 06:00:00,6,Av Corrientes Y Av Callao,Avenida,Corrientes Av.,Si,Corrientes Av. Y Callao Av.,3,Point (106513.41423248 102752.75354401),-58.39228965,-34.60443527,Moto-Pasajeros,Moto,Pasajeros,Conductor,Masculino,34,Balvanera y San Cristóbal.,6,Domingo,Mañana
2016-0036,1,2016-03-14,2016,3,14,2024-01-16 00:15:00,0,Herrera Y Aristobulo Del Valle,Calle,Herrera,Si,"Herrera Y Valle, Aristobulo Del",4,Point (107808.84957181 99174.17105826),-58.37813396,-34.63668504,Moto-Pasajeros,Moto,Pasajeros,Pasajero_Acompañante,Masculino,36,"La Boca, Barracas, Parque Patricios y Nueva Pompeya.",0,Lunes,Madrugada
2016-0037,1,2016-03-19,2016,3,19,2024-01-16 11:00:00,11,Av. Eva Peron Y Quirno,Avenida,Lafuente Av.,Si,Lafuente Av. Y Quirno,7,Point (100049.60313526 98412.21255444),-58.46275892,-34.64358293,Moto-Moto,Moto,Moto,Conductor,Masculino,20,Flores y Parque Chacabuco.,5,Sábado,Mañana
2016-0038,1,2016-03-21,2016,3,21,2024-01-16 08:06:00,8,Av Gral Paz Colectora Y Zuviria,Gral Paz,"Paz, Gral. Av.",Si,"Paz, Gral. Av. Y Zuviria",8,Point (96926.79887463 94490.76318635),-58.49683458,-34.67892743,Peaton-Pasajeros,Peaton,Pasajeros,Peaton,Masculino,29,"Villa Soldati, Villa Riachuelo y Villa Lugano.",0,Lunes,Mañana
2016-0039,1,2016-03-23,2016,3,23,2024-01-16 01:50:00,1,Bartolome Mitre Y Av Pueyrredon,Avenida,"Mitre, Bartolome",Si,"Mitre, Bartolome Y Pueyrredon Av.",3,Point (105252.60308563 102264.96028996),-58.40603217,-34.6088396,Moto-Pasajeros,Moto,Pasajeros,Conductor,Masculino,20,Balvanera y San Cristóbal.,2,Miércoles,Madrugada
2016-0041,2,2016-03-29,2016,3,29,2024-01-16 11:00:00,11,Av Directorio Y Rivera Indarte,Avenida,Directorio Av.,Si,Directorio Av. Y Rivera Indarte Av.,7,Point (100232.38564985 99530.25843190),-58.4607655,-34.63350444,Moto-Cargas,Moto,Cargas,Conductor,Masculino,54,Flores y Parque Chacabuco.,1,Martes,Mañana
2016-0041,2,2016-03-29,2016,3,29,2024-01-16 11:00:00,11,Av Directorio Y Rivera Indarte,Avenida,Directorio Av.,Si,Directorio Av. Y Rivera Indarte Av.,7,Point (100232.38564985 99530.25843190),-58.4607655,-34.63350444,Moto-Cargas,Moto,Cargas,Pasajero_Acompañante,Masculino,40,Flores y Parque Chacabuco.,1,Martes,Mañana
2016-0043,1,2016-03-30,2016,3,30,2024-01-16 18:15:00,18,Dellepiane Luis Tte Gral Colectora Y Murguiondo,Avenida,"Dellepiane, Luis, Tte. Gral.",Si,"Dellepiane, Luis, Tte. Gral. Y Murguiondo",8,Point (98623.04338909 94933.06478837),-58.47832463,-34.67494416,Peaton-Cargas,Peaton,Cargas,Peaton,Femenino,56,"Villa Soldati, Villa Riachuelo y Villa Lugano.",2,Miércoles,Noche
2016-0044,1,2016-03-31,2016,3,31,2024-01-16 19:40:00,19,Av Jose Maria Moreno Y Balbastro,Avenida,"Moreno, Jose Maria Av.",Si,"Moreno, Jose Maria Av. Y Balbastro",7,Point (102857.73817324 99148.76714504),-58.43213235,-34.63693953,Multiple,Moto,Multiple,Conductor,Masculino,24,Flores y Parque Chacabuco.,3,Jueves,Noche
2016-0045,1,2016-04-11,2016,4,11,2024-01-16 10:25:00,10,Av Gral Paz Y Av Del Libertador,Gral Paz,"Paz, Gral. Av.",Si,"Paz, Gral. Av. Y Del Libertador Av.",13,Point (99620.34936816 110483.29286598),-58.46743471,-34.53476874,Moto-Sd,Moto,Sd,Conductor,Masculino,40,"Núñez, Belgrano y Colegiales.",0,Lunes,Mañana
2016-0047,1,2016-04-15,2016,4,15,2024-01-16 05:30:00,5,Lima 1483,Calle,Lima,No,Lima 1483,1,Point (107412.19098904 100391.02557777),-58.38247061,-34.62571878,Peaton-Pasajeros,Peaton,Pasajeros,Peaton,Masculino,41,"Retiro, San Nicolás, Puerto Madero, San Telmo, Montserrat y Constitución.",4,Viernes,Madrugada
2016-0048,1,2016-04-15,2016,4,15,2024-01-16 17:40:00,17,Av. Corrientes Y Av. Dorrego,Avenida,Corrientes Av.,Si,Corrientes Av. Y Dorrego Av.,15,Point (101440.29935254 104167.40204334),-58.44759966,-34.5917024,Peaton-Pasajeros,Peaton,Pasajeros,Peaton,Femenino,51,"Chacarita, Villa Crespo, La Paternal, Villa Ortúzar, Agronomía y Parque Chas.",4,Viernes,Tarde
2016-0049,1,2016-04-17,2016,4,17,2024-01-16 00:00:00,0,"Autopista 1 Sur Presidente Arturo Frondizi Km. 0,700",Autopista,Autopista 1 Sur Presidente Arturo Frondizi,No,Autopista 1 Sur Presidente Arturo Frondizi,4,Point (0 0),-58.37714647568196,-34.63657525428238,Sd-Sd,Sd,Sd,Peaton,Masculino,40,"La Boca, Barracas, Parque Patricios y Nueva Pompeya.",6,Domingo,Madrugada
2016-0050,1,2016-04-19,2016,4,19,2024-01-16 09:50:00,9,Timoteo Gordillo Y Av Fernandez De La Cruz,Avenida,"Gordillo, Timoteo",Si,"Gordillo, Timoteo Y Fernandez De La Cruz, F., Gral. Av.",8,Point (99106.14718950 93761.32882893),-58.47305463,-34.68550712,Peaton-Pasajeros,Peaton,Pasajeros,Peaton,Masculino,78,"Villa Soldati, Villa Riachuelo y Villa Lugano.",1,Martes,Mañana
2016-0051,1,2016-04-20,2016,4,20,2024-01-16 04:00:00,4,Av Amancio Alcorta Y Bonavena,Avenida,"Alcorta, Amancio Av.",Si,"Alcorta, Amancio Av. Y Bonavena, Oscar Natalio",4,Point (105230.98315750 97613.97258373),-58.40623949,-34.65076549,Moto-Cargas,Moto,Cargas,Conductor,Masculino,36,"La Boca, Barracas, Parque Patricios y Nueva Pompeya.",2,Miércoles,Madrugada
2016-0052,1,2016-04-20,2016,4,20,2024-01-16 20:00:00,20,Autopista Lugones Pk 10000,Autopista,"Lugones, Leopoldo Av.",No,Autopista Lugones Pk 10000,13,Point (0 0),0.0,0.0,Moto-Sd,Moto,Sd,Conductor,Masculino,40,"Núñez, Belgrano y Colegiales.",2,Miércoles,Noche
2016-0053,1,2016-04-22,2016,4,22,2024-01-16 09:30:00,9,Av Triunvirato Y Av Olazabal,Avenida,Triunvirato Av.,Si,Triunvirato Av. Y Olazabal Av.,12,Point (98073.80557770 105955.73972818),-58.4842918,-34.57558053,Peaton-Pasajeros,Peaton,Pasajeros,Peaton,Masculino,38,"Coghlan, Saavedra, Villa Urquiza y Villa Pueyrredón.",4,Viernes,Mañana
2016-0054,1,2016-04-23,2016,4,23,2024-01-16 21:00:00,21,Au Luis Dellepiane Y Av Gral Paz,Autopista,Autopista Dellepiane Luis Tte. Gral.,Si,"Autopista Dellepiane Luis Tte. Gral. Y Paz, Gral. Av.",8,Point (97832.57143731 93489.83736533),-58.48695354,-34.68795245,Moto-Moto,Moto,Moto,Conductor,Masculino,30,"Villa Soldati, Villa Riachuelo y Villa Lugano.",5,Sábado,Noche
2016-0055,1,2016-04-25,2016,4,25,2024-01-16 20:30:00,20,Ramon Castilla Y Av Figueroa Alcorta,Avenida,"Castilla, Ramon, Mariscal",Si,"Castilla, Ramon, Mariscal Y Figueroa Alcorta, Pres. Av.",14,Point (105787.74102401 105502.98340149),-58.40021959,-34.57964781,Peaton-Cargas,Peaton,Cargas,Peaton,Masculino,79,Palermo.,0,Lunes,Noche
2016-0056,1,2016-04-26,2016,4,26,2024-01-16 04:45:00,4,Av Luis Maria Campos 30,Avenida,"Campos, Luis M. Av.",No,"Campos, Luis M. Av. 30",14,Point (103094.06446966 105842.29634122),-58.42957885,-34.57660058,Moto-Objeto Fijo,Moto,Objeto Fijo,Conductor,Masculino,26,Palermo.,1,Martes,Madrugada
2016-0058,1,2016-05-04,2016,5,4,2024-01-16 14:00:00,14,Lima 1471,Calle,Lima,No,Lima 1471,1,Point (107411.76356149 100408.31441284),-58.38247542,-34.62556293,Peaton-Moto,Peaton,Moto,Peaton,Femenino,57,"Retiro, San Nicolás, Puerto Madero, San Telmo, Montserrat y Constitución.",2,Miércoles,Tarde
2016-0059,1,2016-05-08,2016,5,8,2024-01-16 16:30:00,16,Pasaje Ciudadela Y Lima Oeste,Calle,Ciudadela,Si,Ciudadela Y Lima,1,Point (107434.83290791 100217.70308007),-58.38222219,-34.62728101,Peaton-Pasajeros,Peaton,Pasajeros,Peaton,Masculino,37,"Retiro, San Nicolás, Puerto Madero, San Telmo, Montserrat y Constitución.",6,Domingo,Tarde
2016-0064,1,2016-05-14,2016,5,14,2024-01-16 18:11:00,18,Av Juan B Justo Y Av Carrasco,Avenida,"Justo, Juan B. Av.",Si,"Justo, Juan B. Av. Y Carrasco Av.",10,Point (97106.70264812 99970.19547024),-58.49485242,-34.62953445,Peaton-Pasajeros,Peaton,Pasajeros,Peaton,Masculino,20,"Villa Real, Monte Castro, Versalles, Floresta, Vélez Sarsfield y Villa Luro.",5,Sábado,Noche
2016-0065,1,2016-05-20,2016,5,20,2024-01-16 14:40:00,14,Av Gaona Y Espinosa,Avenida,Gaona Av.,Si,Gaona Av. Y Espinosa,6,Point (101010.75965434 102062.18185970),-58.45227946,-34.61068024,Peaton-Auto,Peaton,Auto,Peaton,Masculino,20,Caballito.,4,Viernes,Tarde
2016-0067,1,2016-05-21,2016,5,21,2024-01-16 17:00:00,17,Av Lisandro De La Torre Y Saraza,Avenida,"De La Torre, Lisandro",Si,"De La Torre, Lisandro Y Saraza",8,Point (98052.13008621 94912.60873025),-58.48455411,-34.6751276,Moto-Pasajeros,Moto,Pasajeros,Pasajero_Acompañante,Femenino,30,"Villa Soldati, Villa Riachuelo y Villa Lugano.",5,Sábado,Tarde
2016-0068,1,2016-05-22,2016,5,22,2024-01-16 22:00:00,22,Av Figueroa Alcorta Y Av Pueyrredon,Avenida,"Figueroa Alcorta, Pres. Av.",Si,"Figueroa Alcorta, Pres. Av. Y Pueyrredon Av.",2,Point (106673.12856878 104998.99234220),-58.39056593,-34.58418569,Moto-Pasajeros,Moto,Pasajeros,Conductor,Masculino,58,Recoleta.,6,Domingo,Noche
2016-0069,1,2016-05-23,2016,5,23,2024-01-16 03:30:00,3,Av Entre Rios Y Pasaje Filiberto,Avenida,Entre Rios Av.,Si,Entre Rios Av. Y Filiberto,3,Point (106612.54991859 100244.75667446),-58.39118948,-34.62704273,Auto-Cargas,Auto,Cargas,Conductor,Masculino,30,Balvanera y San Cristóbal.,0,Lunes,Madrugada
2016-0073,1,2016-06-11,2016,6,11,2024-01-16 15:00:00,15,Magariños Cervantes 3900,Calle,"Magari?Os Cervantes, A.",No,"Magariã‘Os Cervantes, A. 3900",10,Point (97531.24792840 101000.15957301),-58.49021952,-34.62025108,Moto-Cargas,Moto,Cargas,Conductor,Masculino,23,"Villa Real, Monte Castro, Versalles, Floresta, Vélez Sarsfield y Villa Luro.",5,Sábado,Tarde
2016-0074,1,2016-06-12,2016,6,12,2024-01-16 06:40:00,6,Av Gral Paz Y Rodolfo Scapino,Gral Paz,"Paz, Gral. Av.",Si,"Paz, Gral. Av. Y Scapino, Rodolfo",8,Point (96731.44252651 94668.88351657),-58.49896559,-34.67732118,Auto-Auto,Auto,Auto,Conductor,Masculino,60,"Villa Soldati, Villa Riachuelo y Villa Lugano.",6,Domingo,Mañana
2016-0075,1,2016-06-12,2016,6,12,2024-01-16 23:13:00,23,Autopista Dellepiane Luis Tte Gral Y Miralla,Autopista,Autopista Dellepiane Luis Tte. Gral.,Si,Autopista Dellepiane Luis Tte. Gral. Y Miralla,8,Point (98963.32962830 95620.61360192),-58.47461076,-34.66874679,Peaton-Auto,Peaton,Auto,Peaton,Masculino,42,"Villa Soldati, Villa Riachuelo y Villa Lugano.",6,Domingo,Noche
2016-0076,1,2016-06-13,2016,6,13,2024-01-16 16:20:00,16,Av San Martin Y Camarones,Avenida,San Martin Av.,Si,San Martin Av. Y Camarones,15,Point (100109.22264405 102851.86942760),-58.46210891,-34.60356211,Peaton-Pasajeros,Peaton,Pasajeros,Peaton,Femenino,53,"Chacarita, Villa Crespo, La Paternal, Villa Ortúzar, Agronomía y Parque Chas.",0,Lunes,Tarde
2016-0077,1,2016-06-13,2016,6,13,2024-01-16 21:52:00,21,Tteg Juan D Peron Y Avda Leandro N Alem,Avenida,"Peron, Juan Domingo, Tte. General",Si,"Peron, Juan Domingo, Tte. General Y Alem, Leandro N. Av.",1,Point (108532.37320501 102648.40418720),-58.3702777,-34.60536123,Peaton-Pasajeros,Peaton,Pasajeros,Peaton,Femenino,51,"Retiro, San Nicolás, Puerto Madero, San Telmo, Montserrat y Constitución.",0,Lunes,Noche
2016-0078,1,2016-06-13,2016,6,13,2024-01-16 23:01:00,23,Av Belgrano Y Av Jujuy,Avenida,Belgrano Av.,Si,Belgrano Av. Y Jujuy Av.,3,Point (105354.74322032 101621.63182427),-58.40491455,-34.6146383,Moto-Moto,Moto,Moto,Conductor,Masculino,30,Balvanera y San Cristóbal.,0,Lunes,Noche
2016-0079,1,2016-06-16,2016,6,16,2024-01-16 17:13:00,17,Av Del Libertador Y Av Guillermo Udaondo,Avenida,Del Libertador Av.,Si,"Del Libertador Av. Y Udaondo, Guillermo Av.",13,Point (100757.94817512 108943.96108781),-58.45504154,-34.54864492,Auto-Auto,Auto,Auto,Conductor,Femenino,51,"Núñez, Belgrano y Colegiales.",3,Jueves,Tarde
2016-0080,1,2016-06-18,2016,6,18,2024-01-16 06:42:00,6,Av Gral Paz Y Av Rivadavia,Gral Paz,"Paz, Gral. Av.",Si,"Paz, Gral. Av. Y Rivadavia Av.",9,Point (93950.50587297 98883.37644525),-58.52927982,-34.63931752,Auto-Sd,Auto,Sd,Conductor,Masculino,60,"Liniers, Mataderos y Parque Avellaneda.",5,Sábado,Mañana
2016-0081,1,2016-06-22,2016,6,22,2024-01-16 07:42:00,7,Av Crisologo Larralde Y Machain,Avenida,"Larralde, Crisologo Av.",Si,"Larralde, Crisologo Av. Y Machain",12,Point (97805.54034401 107789.89169078),-58.4872106,-34.55904606,Moto-Auto,Moto,Auto,Conductor,Masculino,40,"Coghlan, Saavedra, Villa Urquiza y Villa Pueyrredón.",2,Miércoles,Mañana
2016-0082,1,2016-06-27,2016,6,27,2024-01-16 18:24:00,18,Av La Plata 2384,Avenida,La Plata Av.,No,La Plata Av. 2384,4,Point (103719.51591058 98555.13443768),-58.42273092,-34.64228803,Peaton-Auto,Peaton,Auto,Peaton,Masculino,87,"La Boca, Barracas, Parque Patricios y Nueva Pompeya.",0,Lunes,Noche
2016-0083,1,2016-06-28,2016,6,28,2024-01-16 20:46:00,20,Av Juan B Alberdi Y Puan,Avenida,"Alberdi, Juan Bautista Av.",Si,"Alberdi, Juan Bautista Av. Y Puan",6,Point (101413.41644585 100430.31523295),-58.44788671,-34.62539009,Peaton-Moto,Peaton,Moto,Peaton,Femenino,76,Caballito.,1,Martes,Noche
2016-0084,1,2016-06-29,2016,6,29,2024-01-16 22:00:00,22,Carlos Pellegrini Y Tucuman,Calle,"Pellegrini, Carlos",Si,"Pellegrini, Carlos Y Tucuman",1,Point (107539.54864414 103093.65031518),-58.38110563,-34.60135531,Peaton-Pasajeros,Peaton,Pasajeros,Peaton,Masculino,57,"Retiro, San Nicolás, Puerto Madero, San Telmo, Montserrat y Constitución.",2,Miércoles,Noche
2016-0085,1,2016-06-29,2016,6,29,2024-01-16 22:00:00,22,Avda Ite Francisco Rabanal & Avda Erezcano,Avenida,"Rabanal, Francisco, Intendente Av.",Si,"Rabanal, Francisco, Intendente Av. Y Erezcano",4,Point (103621.92252760 96885.28433165),-58.42378834,-34.657341,Moto-Movil,Moto,Otro,Conductor,Masculino,40,"La Boca, Barracas, Parque Patricios y Nueva Pompeya.",2,Miércoles,Noche
2016-0086,1,2016-06-30,2016,6,30,2024-01-16 16:10:00,16,Av Olivera Y Ramon Falcon,Avenida,Olivera Av.,Si,"Olivera Av. Y Falcon, Ramon L.,Cnel.",10,Point (97801.31825511 99194.93911759),-58.48727942,-34.63652467,Peaton-Pasajeros,Peaton,Pasajeros,Peaton,Masculino,75,"Villa Real, Monte Castro, Versalles, Floresta, Vélez Sarsfield y Villa Luro.",3,Jueves,Tarde
2016-0087,1,2016-07-02,2016,7,3,2024-01-16 00:10:00,0,Autopista 1 Sur Pte Arturo Frondizi Y Av Caseros,Autopista,Autopista 1 Sur Presidente Arturo Frondizi,No,Autopista 1 Sur Presidente Arturo Frondizi Y Caseros Av.,1,Point (107762.62066736 100018.90176187),-58.37864583,-34.62907067,Moto-Objeto Fijo,Moto,Objeto Fijo,Conductor,Masculino,23,"Retiro, San Nicolás, Puerto Madero, San Telmo, Montserrat y Constitución.",5,Sábado,Madrugada
2016-0088,1,2016-07-11,2016,7,11,2024-01-16 15:30:00,15,Ceretti Y Nuñez,Calle,Ceretti,Si,Ceretti Y Nuã‘Ez,12,Point (96492.89040317 106832.19475660),-58.5015175,-34.56767549,Peaton-Auto,Peaton,Auto,Peaton,Femenino,70,"Coghlan, Saavedra, Villa Urquiza y Villa Pueyrredón.",0,Lunes,Tarde
2016-0089,1,2016-07-14,2016,7,14,2024-01-16 06:40:00,6,Av Lugones Y La Pampa,Autopista,"Lugones, Leopoldo Av.",Si,"Lugones, Leopoldo Av. Y La Pampa",13,Point (102842.06561704 108587.10659007),-58.43233425,-34.55185825,Peaton-Auto,Peaton,Auto,Peaton,Masculino,35,"Núñez, Belgrano y Colegiales.",3,Jueves,Mañana
2016-0090,1,2016-07-14,2016,7,14,2024-01-16 22:00:00,22,Jeronimo Salguero Y Av Rivadavia,Avenida,"Salguero, Jeronimo",Si,"Salguero, Jeronimo Y Rivadavia Av.",5,Point (103997.04813615 102012.34139150),-58.41971993,-34.6111224,Peaton-Pasajeros,Peaton,Pasajeros,Peaton,Masculino,60,Almagro y Boedo.,3,Jueves,Noche
2016-0092,1,2016-07-15,2016,7,15,2024-01-16 11:00:00,11,Av Gral Paz Y Av Libertador,Gral Paz,"Paz, Gral. Av.",Si,"Paz, Gral. Av. Y Del Libertador Av.",13,Point (99620.34936816 110483.29286598),-58.46743471,-34.53476874,Moto-Cargas,Moto,Cargas,Conductor,Masculino,24,"Núñez, Belgrano y Colegiales.",4,Viernes,Mañana
2016-0093,1,2016-07-17,2016,7,17,2024-01-16 03:30:00,3,Av Juan B Alberdi Y Emilio Mitre,Avenida,"Alberdi, Juan Bautista Av.",Si,"Alberdi, Juan Bautista Av. Y Mitre, Emilio",6,Point (101804.61714036 100693.45218194),-58.44362126,-34.62301748,Auto-Auto,Auto,Auto,Conductor,Masculino,35,Caballito.,6,Domingo,Madrugada
2016-0095,1,2016-07-23,2016,7,23,2024-01-16 06:12:00,6,Mercedes Y Av Gral Mosconi,Avenida,Mercedes,Si,Mercedes Y Mosconi General Av.,11,Point (95061.77375682 103748.74085597),-58.51713095,-34.59546519,Moto-Auto,Moto,Auto,Conductor,Masculino,29,"Villa General Mitre, Villa Devoto, Villa del Parque y Villa Santa Rita.",5,Sábado,Mañana
2016-0096,1,2016-07-25,2016,7,25,2024-01-16 07:00:00,7,"Autopista Dellepiane Luis Tte. Gral. Km. 2,3",Autopista,Autopista Dellepiane Luis Tte. Gral.,No,Autopista Dellepiane Luis Tte. Gral.,8,Point (0 0),-58.47433193007387,-34.66684950051973,Moto-Cargas,Moto,Cargas,Conductor,Masculino,40,"Villa Soldati, Villa Riachuelo y Villa Lugano.",0,Lunes,Mañana
2016-0097,1,2016-07-26,2016,7,26,2024-01-16 18:45:00,18,Solis Y Mexico,Calle,Solis,Si,Solis Y Mexico,1,Point (106687.13301820 101510.97040757),-58.39038605,-34.6156281,Peaton-Auto,Peaton,Auto,Peaton,Masculino,80,"Retiro, San Nicolás, Puerto Madero, San Telmo, Montserrat y Constitución.",1,Martes,Noche
2016-0098,1,2016-07-27,2016,7,27,2024-01-16 16:08:00,16,Av San Juan Y Alberti,Avenida,San Juan Av.,Si,San Juan Av. Y Alberti,3,Point (105765.97394356 100631.47718024),-58.40042405,-34.62356174,Moto-Cargas,Moto,Cargas,Conductor,Femenino,43,Balvanera y San Cristóbal.,2,Miércoles,Tarde
2016-0099,1,2016-07-29,2016,7,29,2024-01-16 16:00:00,16,Av Gral Mosconi Y Av Gral Paz,Gral Paz,Mosconi General Av.,Si,"Mosconi General Av. Y Paz, Gral. Av.",11,Point (94486.28631712 103468.59928582),-58.52340614,-34.59798754,Cargas-Cargas,Cargas,Cargas,Conductor,Masculino,45,"Villa General Mitre, Villa Devoto, Villa del Parque y Villa Santa Rita.",4,Viernes,Tarde
